"Story","Title","Result","Date","Stability","Duration (s)"
"Create shipment ordered by phone","Create a new shipment based on minimal required information","PENDING","2016-12-23T08:29:13.641Z","0.0","0.1"
"Search for shipments by customer","Display a message if the search string does not match any case","PENDING","2016-12-23T08:29:14.199Z","0.0","0.03"
"Show list of tasks for current user","Display a message if there is no task assigned to current user","PENDING","2016-12-23T08:29:13.949Z","0.0","0.03"
"Show list of tasks for current user","List all tasks assigned to current user","PENDING","2016-12-23T08:29:13.918Z","0.0","0.03"
"Show current shipments","List open shipments with 5 shipments","PENDING","2016-12-23T08:29:14.234Z","0.0","0.01"
"Search for shipments by customer","Search for shipments by exact customer name","PENDING","2016-12-23T08:29:14.081Z","0.0","0.03"
"Search for shipments by customer","Search for shipments by substrings of customer name","PENDING","2016-12-23T08:29:14.111Z","0.0","0.09"
"Show details of a shipment","Show the details of a shipment","PENDING","2016-12-23T08:29:13.999Z","0.0","0.07"
