"Story","Title","Result","Date","Stability","Duration (s)"
"Create shipment ordered by phone","Create a new shipment based on minimal required information","PENDING","2017-02-02T06:42:52.834Z","0.0","0.08"
"Search for shipments by customer","Display a message if the search string does not match any case","PENDING","2017-02-02T06:42:53.209Z","0.0","0.02"
"Show list of tasks for current user","Display a message if there is no task assigned to current user","PENDING","2017-02-02T06:42:53.035Z","0.0","0.01"
"Show list of tasks for current user","List all tasks assigned to current user","PENDING","2017-02-02T06:42:53.017Z","0.0","0.02"
"Show current shipments","List open shipments with 5 shipments","PENDING","2017-02-02T06:42:53.239Z","0.0","0.02"
"Search for shipments by customer","Search for shipments by exact customer name","PENDING","2017-02-02T06:42:53.168Z","0.0","0.02"
"Search for shipments by customer","Search for shipments by substrings of customer name","PENDING","2017-02-02T06:42:53.187Z","0.0","0.02"
"Show details of a shipment","Show the details of a shipment","PENDING","2017-02-02T06:42:53.059Z","0.0","0.1"
