"Story","Title","Result","Date","Stability","Duration (s)"
"Search-for-cases-by-customer","Display a message if the search string does not match any case","PENDING","2016-10-14T12:31:36.604Z","0.0","0.02"
"Show-list-of-tasks-for-current-user","Display a message if there is no task assigned to current user","PENDING","2016-10-14T12:31:36.503Z","0.0","0.02"
"Show-list-of-tasks-for-current-user","List all tasks assigned to current user","PENDING","2016-10-14T12:31:36.447Z","0.0","0.06"
"Show-cases","List open cases with 5 cases","PENDING","2016-10-14T12:31:21.838Z","0.0","0.17"
"Search-for-cases-by-customer","Search for cases by exact customer name","PENDING","2016-10-14T12:31:36.540Z","0.0","0.03"
"Search-for-cases-by-customer","Search for cases by substrings of customer name","PENDING","2016-10-14T12:31:36.575Z","0.0","0.03"
"Show-details-of-a-case","Show the details of a case","PENDING","2016-10-14T12:31:36.636Z","0.0","0.01"
