"Story","Title","Result","Date","Stability","Duration (s)"
"Search-for-cases-by-customer","Display a message if the search string does not match any case","PENDING","2016-10-20T14:11:38.759Z","0.0","0.03"
"Show-list-of-tasks-for-current-user","Display a message if there is no task assigned to current user","PENDING","2016-10-20T14:11:38.618Z","0.0","0.04"
"Show-list-of-tasks-for-current-user","List all tasks assigned to current user","PENDING","2016-10-20T14:11:38.602Z","0.0","0.02"
"Show-cases","List open cases with 1 case","SUCCESS","2016-10-20T14:11:33.265Z","0.0","5.24"
"Show-cases","List open cases with 5 cases","PENDING","2016-10-20T14:11:25.402Z","0.0","0.08"
"Show-cases","List open cases without cases","SUCCESS","2016-10-20T14:11:25.655Z","0.0","7.6"
"Search-for-cases-by-customer","Search for cases by exact customer name","PENDING","2016-10-20T14:11:38.666Z","0.0","0.06"
"Search-for-cases-by-customer","Search for cases by substrings of customer name","PENDING","2016-10-20T14:11:38.727Z","0.0","0.03"
"Show-details-of-a-case","Show the details of a case","PENDING","2016-10-20T14:11:38.803Z","0.0","0.03"
